{
  "$schema": "https://json-schema.org/draft/2020-12/schema",
  "$id": "https://github.com/gyulyia3d-cloud/ai-vj-generator/schema/project.schema.json",
  "title": "AI VJ Generator project (schema ai-vj-generator/2)",
  "description": "Structure only. Layer parameters, GLSL rules, audio roles and craft rules are checked by scripts/validate_project.py. Any AI that can write this JSON can drive the engine.",
  "type": "object",
  "required": ["schema", "canvas", "time", "compositions"],
  "properties": {
    "schema": { "type": "string", "enum": ["ai-vj-generator/1", "ai-vj-generator/2"] },
    "id": { "type": "string", "minLength": 1 },
    "seed": { "type": "integer" },
    "meta": {
      "type": "object",
      "properties": {
        "name": { "type": "string" },
        "lang": { "type": "string", "enum": ["en", "pt"] },
        "brief": { "type": "string" },
        "contract": { "type": "object" },
        "compositionIR": { "type": "array", "description": "One Composition IR per composition (references/composition-ir.md): grammar, zones, negative space, focal point, mass, balance, movement axis, density map, phases." },
        "audioSemantics": { "type": "array", "description": "One summary per composition (references/audio-semantics.md): strategy, budget of listening layers, how many listen, and each layer's behavior and bands." },
        "depthIR": { "type": "array", "description": "One Depth IR per composition (references/depth-ir.md): the camera, the depth planes, the focus plane, the parallax numbers on this surface and the seam rule." },
        "animationIR": { "type": "array", "description": "One Animation IR per composition (references/animation-ir.md): archetype, timing in musical time, who leads and who follows and how late, easing, anticipation, settle, phase choreography, events on the beat grid." },
        "creativeIR": { "type": "object", "description": "Creative IR compiled from the brief (references/creative-ir.md): concept, visual verbs, motifs, hierarchy, behaviours." },
        "artBible": {
          "type": "object",
          "properties": {
            "thesis": { "type": "string" }, "material": { "type": "string" }, "space": { "type": "string" }, "motion": { "type": "string" },
            "dramaturgy": { "type": "string" }, "color": { "type": "string" }, "typography": { "type": "string" }, "audio": { "type": "string" }, "banned": { "type": "string" }, "density": { "type": "string", "enum": ["sparse", "balanced", "dense"] },
            "motionProfile": {
              "type": "object",
              "properties": {
                "energy": { "type": "number", "minimum": 0, "maximum": 1 }, "elasticity": { "type": "number", "minimum": 0, "maximum": 1 },
                "anticipation": { "type": "number", "minimum": 0, "maximum": 1 }, "continuity": { "type": "number", "minimum": 0, "maximum": 1 },
                "rhythm": { "type": "number", "minimum": 0, "maximum": 1 }
              }
            }
          }
        },
        "spec": { "type": "object" }
      }
    },
    "canvas": {
      "type": "object",
      "required": ["w", "h"],
      "properties": {
        "w": { "type": "integer", "minimum": 16, "maximum": 16384 },
        "h": { "type": "integer", "minimum": 16, "maximum": 16384 },
        "fps": { "type": "integer", "enum": [24, 25, 30, 50, 60] },
        "target": { "type": "string", "enum": ["screen", "led", "projection", "mapping", "multi", "software", "export"] },
        "folds": { "type": "array", "items": { "type": "number" } },
        "safe": { "type": "number", "minimum": 0, "maximum": 0.4 }
      }
    },
    "time": {
      "type": "object",
      "properties": {
        "bpm": { "type": "number", "minimum": 40, "maximum": 240 },
        "bars": { "type": "integer", "enum": [1, 2, 4, 8, 16, 32] },
        "loop": { "type": "boolean" },
        "seamless": { "type": "boolean" },
        "transition": { "type": "string", "enum": ["cut", "fade", "wipe", "glitch", "zoom", "slide", "iris", "blinds", "crosszoom", "spin", "radial", "diagonal", "slices", "flip", "blur", "drop"] }
      }
    },
    "audio": {
      "type": "object",
      "properties": {
        "reactive": { "type": "boolean" },
        "sens": { "type": "number", "minimum": 0, "maximum": 4 },
        "smooth": { "type": "number", "minimum": 0, "maximum": 0.98 },
        "strategy": { "type": "string", "enum": ["none", "subtle", "structural", "rhythmic", "full"] }
      }
    },
    "palette": {
      "type": "object",
      "properties": {
        "bg": { "type": "string" }, "primary": { "type": "string" }, "secondary": { "type": "string" }, "accent": { "type": "string" },
        "mode": { "type": "string", "enum": ["white-alpha"] }
      }
    },
    "compositions": {
      "type": "array",
      "minItems": 1,
      "items": {
        "type": "object",
        "required": ["name", "layers"],
        "properties": {
          "name": { "type": "string", "minLength": 1 },
          "hypothesis": { "type": "string" },
          "camera": { "type": "object", "description": "2.5D camera of the composition (references/depth-ir.md). Layers with a `z` sit on planes the camera moves in parallax, perspective, fog and focus. Whole cycles per loop, never listens to the audio.", "required": ["move"], "properties": { "move": { "type": "string", "enum": ["still","sway","crane","orbit","dolly","rack"] }, "amp": { "type": "number", "minimum": 0, "maximum": 1 }, "cycles": { "type": "integer", "minimum": 0 }, "phase": { "type": "number", "minimum": 0, "maximum": 1 }, "focus": { "type": "number", "minimum": -1, "maximum": 1 }, "fog": { "type": "number", "minimum": 0, "maximum": 1 }, "dof": { "type": "number", "minimum": 0, "maximum": 0.1 }, "steps": { "type": "integer", "minimum": 2, "maximum": 32 } } },
          "motion": { "type": "string", "enum": ["step", "smooth"] },
          "layers": {
            "type": "array",
            "minItems": 1,
            "items": {
              "type": "object",
              "required": ["type"],
              "properties": {
                "type": { "type": "string", "enum": ["bg","organism","structure","measure","data","hud","event","post","lines","instrument","bitfield","sim","parallax","splat","flow","tunnel","typewall","shader","image","video","model","shape","text","typeset","code","pixeltext","symbols","hazard","blocks","logo","isf","fx","synth","blobs","temporal","field","glyphs"] },
                "name": { "type": "string" },
                "role": { "type": "string" },
                "temporal": { "type": "object", "description": "Audio semantics (references/audio-semantics.md): how the layer keeps time. still, drift and beat never listen to the audio; follow, accent and section listen to the declared band classes.", "required": ["behavior"], "properties": { "behavior": { "type": "string", "enum": ["still", "drift", "beat", "follow", "accent", "section"] }, "listens": { "type": "array", "items": { "type": "string", "enum": ["bass", "mid", "high", "hit", "level"] } }, "reason": { "type": "string" } } },
                "z": { "type": "number", "minimum": -1, "maximum": 1, "description": "Depth plane for the 2.5D camera (references/depth-ir.md): -1 far, +1 near. Absent = screen plane (text, meters, finish): no parallax, fog or blur." },
                "on": { "type": "boolean" },
                "opacity": { "type": "number", "minimum": 0, "maximum": 1 },
                "blend": { "type": "string", "enum": ["normal", "add", "screen", "multiply", "difference", "overlay", "lighten"] },
                "p": { "type": "object" },
                "mod": {
                  "type": "array",
                  "items": {
                    "type": "object",
                    "required": ["k", "src"],
                    "properties": {
                      "k": { "type": "string" },
                      "src": { "type": "string", "enum": ["bass","mid","high","rms","hit","mhit","hhit","kick","onset","flux","pres","onbeat","bsin","bsin2","bsin4","btri","lfo"] },
                      "min": { "type": "number" }, "max": { "type": "number" },
                      "mode": { "type": "string", "enum": ["set", "add", "mul"] },
                      "cycles": { "type": "integer", "minimum": 1 },
                      "shape": { "type": "string", "enum": ["sin", "tri", "saw", "bounce", "rubber", "shake", "jello", "tada", "heartbeat", "swing", "wobble", "pulse", "spring", "env"] },
                      "zeta": { "type": "number", "minimum": 0.05, "maximum": 3 }, "wn": { "type": "number", "minimum": 1, "maximum": 60 },
                      "ta": { "type": "number", "minimum": 0, "maximum": 0.4 }, "depth": { "type": "number", "minimum": 0, "maximum": 1 }, "steps": { "type": "integer", "minimum": 0, "maximum": 128 }
                    }
                  }
                }
              }
            }
          }
        }
      }
    },
    "assets": { "type": "object" },
    "capabilities": { "type": "object" }
  }
}
