{
  "schema": "ai-vj-generator/1",
  "id": "example-noite-filotaxia",
  "meta": {
    "name": "NOITE FILOTAXIA",
    "artist": "EXEMPLO · TECHNO MELÓDICO",
    "context": "Set de VJ ao vivo · tela 16:9",
    "brief": "Um organismo noturno lido por máquinas. Hipnótico e tecnológico. Começa estrutural, termina em transformação. Evitar: cores saturadas demais, cortes a cada beat.",
    "moods": ["hipnótico", "tecnológico"],
    "grammar": {
      "form": "Pontos em ângulo áureo, anéis, órbitas; linhas finas só como medição",
      "motion": "Matéria em curva, interface em degrau",
      "rhythm": "Respiração em ciclos de loop; evento só a cada 8 compassos",
      "color": "Azul-noite e osso; violeta como único acento",
      "density": "Baixa: o preto trabalha",
      "depth": "Campo de fundo, organismo, leitura, moldura",
      "texture": "Grão vivo, scanline discreta",
      "transition": "Fade de 1 compasso",
      "audio": "Graves respiram o organismo quando o áudio estiver ligado"
    }
  },
  "canvas": { "w": 1920, "h": 1080, "fps": 30, "target": "screen", "safe": 0.05 },
  "time": { "bpm": 124, "bars": 8, "loop": true, "seamless": true, "mode": "loop", "transition": "fade", "trBeats": 4 },
  "audio": { "reactive": false, "sens": 1, "smooth": 0.75 },
  "seed": 240611,
  "palette": { "bg": "#02020A", "primary": "#DCE2FF", "secondary": "#46507A", "accent": "#7B5CFF" },
  "compositions": [
    {
      "name": "ÓRBITA",
      "hypothesis": "ESTRUTURA — só o aparelho: grade, réguas e um anel. O organismo ainda não chegou.",
      "motion": "step",
      "layers": [
        { "type": "bg", "name": "FUNDO", "p": { "grain": 0.4 } },
        { "type": "structure", "name": "ESTRUTURA", "p": { "gridA": 0.05 } },
        { "type": "shape", "name": "ANEL", "opacity": 0.7, "p": { "kind": "ring", "size": 620, "strokeW": 1.5, "pulseAmt": 0.08 } },
        { "type": "hud", "name": "MOLDURA", "p": { "sub": "NOITE / LEITURA 01 / ESPERA", "date": "124 BPM · 1920×1080", "foot": "ÓRBITA · DERIVA · MARÉ · ESPIRAL · RESÍDUO" } },
        { "type": "post", "name": "PÓS", "p": { "scan": 0.2, "prob": 0.1, "slices": 3 } }
      ]
    },
    {
      "name": "DERIVA",
      "hypothesis": "FLUXO — a matéria aparece como campo, sem contorno; nada corta.",
      "motion": "smooth",
      "layers": [
        { "type": "bg", "name": "FUNDO", "p": { "grain": 0.3 } },
        { "type": "shader", "name": "CAMPO", "opacity": 0.45, "blend": "screen", "p": { "preset": "CAMPO FBM", "alphaMode": "alpha", "res": 0.6 } },
        { "type": "flow", "name": "FLUXO", "p": { "count": 1100, "trail": 12, "amp": 0.16, "width": 1.1 } },
        { "type": "post", "name": "PÓS", "p": { "scan": 0.15, "prob": 0.03, "slices": 2 } }
      ]
    },
    {
      "name": "MARÉ",
      "hypothesis": "DENSIDADE — o organismo chega e é lido por todos os instrumentos ao mesmo tempo.",
      "motion": "step",
      "layers": [
        { "type": "bg", "name": "FUNDO" },
        { "type": "organism", "name": "MATÉRIA" },
        { "type": "structure", "name": "ESTRUTURA" },
        { "type": "measure", "name": "MEDIÇÃO" },
        { "type": "data", "name": "DADOS" },
        { "type": "hud", "name": "MOLDURA", "p": { "sub": "NOITE / LEITURA 03 / SCAN ATIVO" } },
        { "type": "event", "name": "EVENTO", "p": { "every": 8, "words": "ÓRBITA|SINAL|LIMIAR" } },
        { "type": "post", "name": "PÓS" }
      ]
    },
    {
      "name": "ESPIRAL",
      "hypothesis": "RITMO — a palavra vira instrumento; o túnel marca o compasso.",
      "motion": "step",
      "layers": [
        { "type": "bg", "name": "FUNDO", "p": { "grain": 0.2 } },
        { "type": "tunnel", "name": "TÚNEL", "opacity": 0.6, "p": { "shape": "circle", "count": 14, "cycles": 1, "weight": 1.5, "twist": 0.6 } },
        { "type": "typewall", "name": "PALAVRA", "p": { "words": "ÓRBITA|SINAL|LIMIAR", "rows": 3, "font": "bebas", "outline": "all", "stroke": 1.5 } },
        { "type": "post", "name": "PÓS", "p": { "scan": 0.2, "prob": 0.25, "slices": 4 } }
      ]
    },
    {
      "name": "RESÍDUO",
      "hypothesis": "TRANSFORMAÇÃO — anéis SDF reescrevem o campo enquanto o organismo se desfaz em células.",
      "motion": "smooth",
      "layers": [
        { "type": "bg", "name": "FUNDO", "p": { "grain": 0.35 } },
        { "type": "shader", "name": "CÉLULAS", "opacity": 0.5, "blend": "screen", "p": { "preset": "CÉLULAS", "alphaMode": "alpha", "res": 0.7 } },
        { "type": "organism", "name": "MATÉRIA", "p": { "cx": 0.5, "size": 1.3, "breathe": 1.6, "spin": 2 } },
        { "type": "measure", "name": "MEDIÇÃO", "opacity": 0.8 },
        { "type": "post", "name": "PÓS", "p": { "scan": 0.2, "prob": 0.15 } }
      ]
    }
  ]
}
